page,name,shop_product_code,img_url
6,SAINT CLOTH MYTH Equuleus Kyoko & Equuleus power up cloth parts set,/hk/item/N2484718001001,https://p-bandai.com/img/hk/p/t/N2484718001001_001.jpg
6,METAL BUILD STRIKE GUNDAM【Second Offer】,/hk/item/N2486322001002,https://p-bandai.com/img/hk/p/t/N2486322001002_001.jpg
6,SOUL OF CHOGOKIN GX-70SPD MAZINGER Z D.C. DAMAGE Ver. ANIME COLOR,/hk/item/N2484750001001,https://p-bandai.com/img/hk/p/t/N2484750001001_001.jpg
6,THE ROBOT SPIRITS (Ka signature) ＜SIDE MS＞ SUPER GUNDAM,/hk/item/N2484811001001,https://p-bandai.com/img/hk/p/t/N2484811001001_001.jpg
6,Figuarts Zero chouette SAILOR URANUS,/hk/item/N2475329001001,https://p-bandai.com/img/hk/p/t/N2475329001001_001.jpg
6,Figuarts Zero chouette SAILOR NEPTUNE,/hk/item/N2475330001001,https://p-bandai.com/img/hk/p/t/N2475330001001_001.jpg
6,PROPLICA CHIBI MOON COMPACT,/hk/item/N2484691001001,https://p-bandai.com/img/hk/p/t/N2484691001001_001.jpg
6,S.H.Figuarts KAMEN RIDER ZI-O II,/hk/item/N2484699001001,https://p-bandai.com/img/hk/p/t/N2484699001001_001.jpg
6,GUNDAM FIX FIGURATION METAL COMPOSITE PSYCHO GUNDAM (GLOSS COLOR Ver.),/hk/item/N2469106001001,https://p-bandai.com/img/hk/p/t/N2469106001001_001.jpg
6,Figuarts ZERO WILD TIGER -BATTLE STYLE-,/hk/item/N2456895001001,https://p-bandai.com/img/hk/p/t/N2456895001001_001.jpg
6,Figuarts ZERO BARNABY BROOKS Jr. -BATTLE STYLE-,/hk/item/N2456896001001,https://p-bandai.com/img/hk/p/t/N2456896001001_001.jpg
6,SOUL OF CHOGOKIN GX-73SP GREAT MAZINGER D.C. Anime Color Version,/hk/item/N2469107001001,https://p-bandai.com/img/hk/p/t/N2469107001001_001.jpg
6,PROPLICA Sheer Heart Attack,/hk/item/N2466320001001,https://p-bandai.com/img/hk/p/t/N2466320001001_001.jpg
6,SAINT CLOTH MYTH EX Aries Shion (Surplice) & The Pope Set,/hk/item/N2455586001001,https://p-bandai.com/img/hk/p/t/N2455586001001_001.jpg
6,SDX SUPERIOR DRAGON DARK,/hk/item/N2451251001001,https://p-bandai.com/img/hk/p/t/N2451251001001_001.jpg
6,THE ROBOT SPIRITS ＜SIDE MS＞ MS-06W ZAKU WORKER ver. A.N.I.M.E.,/hk/item/N2466349001001,https://p-bandai.com/img/hk/p/t/N2466349001001_001.jpg
6,S.H.Figuarts KAMEN RIDER AMAZONS SAIGO NO SHINPAN SET,/hk/item/N2470647001001,https://p-bandai.com/img/hk/p/t/N2470647001001_001.jpg
6,METAL BUILD GUNDAM ASTRAEA＋PROTO GN HIGH MEGA LAUNCHER,/hk/item/N2444492001001,https://p-bandai.com/img/hk/p/t/N2444492001001_001.jpg
6,THE ROBOT SPIRITS (Ka signature) ＜SIDE MS＞ DIJEH (NARRATIVE Ver.),/hk/item/N2461832001001,https://p-bandai.com/img/hk/p/t/N2461832001001_001.jpg
6,METAL ROBOT SPIRITS ＜SIDE KMF＞ Lancelot Albion ZERO,/hk/item/N2462610001001,https://p-bandai.com/img/hk/p/t/N2462610001001_001.jpg
6,SOUL OF CHOGOKIN GX-70SP MAZINGER Z D.C. ANIME COLOR VERSION 【Second Offer】,/hk/item/N2443800001002,https://p-bandai.com/img/hk/p/t/N2443800001002_001.jpg
6,THE ROBOT SPIRITS (Ka signature) ＜SIDE MS＞ NERO LUNAR LANDING TYPE MARKING PLUS Ver.,/hk/item/N2455418001001,https://p-bandai.com/img/hk/p/t/N2455418001001_001.jpg
6,S.H.Figuarts MASKED RIDER 1 (SAKURAJIMA Ver.),/hk/item/N2447902001001,https://p-bandai.com/img/hk/p/t/N2447902001001_001.jpg
6,S.H.Figuarts ULTRAMAN ORB DARK,/hk/item/N2447904001001,https://p-bandai.com/img/hk/p/t/N2447904001001_001.jpg
6,Saint Cloth Myth EX GEMINI SAGA KANON -ORIGINAL COLOR EDITION-,/hk/item/N2447905001001,https://p-bandai.com/img/hk/p/t/N2447905001001_001.jpg
6,THE ROBOT SPIRITS ＜SIDE MS＞ RX-78-2 GUNDAM ＆ G-FIGHTER ver. A.N.I.M.E. -Real Type Color-,/hk/item/N2447908001001,https://p-bandai.com/img/hk/p/t/N2447908001001_001.jpg
6,SDX Solar Knight God Gundam MeikyoShisui Gold Version,/hk/item/N2465670001001,https://p-bandai.com/img/hk/p/t/N2465670001001_001.jpg
6,PROPLICA TRANSFORMATION BROOCH & DISGUISE PEN SET,/hk/item/N2444498001001,https://p-bandai.com/img/hk/p/t/N2444498001001_001.jpg
6,SOUL OF CHOGOKIN GX-70SP MAZINGER Z D.C. ANIME COLOR VERSION,/hk/item/N2443800001001,https://p-bandai.com/img/hk/p/t/N2443800001001_001.jpg
6,THE ROBOT SPIRITS ＜SIDE MS＞ MS-06D ZAKU DESERT TYPE　CARACAL CORPS ver. A.N.I.M.E.,/hk/item/N2455134001001,https://p-bandai.com/img/hk/p/t/N2455134001001_001.jpg
6,METAL ROBOT SPIRITS (Ka signature) ＜SIDE MS＞ Zplus C1 03 SIGMAN CUSTOM,/hk/item/N2455419001001,https://p-bandai.com/img/hk/p/t/N2455419001001_001.jpg
7,S.H.Figuarts (SHINKOCCHOUSEIHOU) MASKED RIDER TODOROKI,/hk/item/N2428261001001,https://p-bandai.com/img/hk/p/t/N2428261001001_007.jpg
7,S.I.C. KAMEN RIDER AMAZON OMEGA,/hk/item/N2451260001001,https://p-bandai.com/img/hk/p/t/N2451260001001_007.jpg
7,Saint Cloth Myth EX MYSTERIOUS SURPLICE 3 SET,/hk/item/N2461079001001,https://p-bandai.com/img/hk/p/t/N2461079001001_005.jpg
7,THE ROBOT SPIRITS 〈SIDE MS〉 RX-78-2 GUNDAM ver. A.N.I.M.E. ～Final battle Specifications～,/hk/item/N2443384001001,https://p-bandai.com/img/hk/p/t/N2443384001001_001.jpg
7,NXEDGESTYLE [EVA UNIT] EVANGELION MASS PRODUCTION MODEL,/hk/item/N2438421001001,https://p-bandai.com/img/hk/p/t/N2438421001001_001.jpg
7,S.H.Figuarts (SHINKOCCHOUSEIHOU) MASKED RIDER 2 50th Anniversary Ver.,/hk/item/N2611061001001,https://p-bandai.com/img/hk/p/t/N2611061001001_001.jpg
7,S.H.Figuarts SON GOKU ULTRA INSTINCT “SIGN”,/hk/item/N2625191001001,https://p-bandai.com/img/hk/p/t/N2625191001001_001.jpg
7,S.H.Figuarts ALIEN MEFILAS 55th Anniversary Ver.,/hk/item/N2627721001001,https://p-bandai.com/img/hk/p/t/N2627721001001_001.jpg
7,S.H.Figuarts KAMEN RIDER JEANNE COBRA GENOME & LOVEKOV KUJAKU GENOME,/hk/item/N2623280001001,https://p-bandai.com/img/hk/p/t/N2623280001001_001.jpg
7,METAL BUILD GUNDAM ASTRAY RED DRAGONICS,/hk/item/N2593474001001,https://p-bandai.com/img/hk/p/t/N2593474001001_001.jpg
7,S.H.Figuarts ULTRAMAN TRIGGER SKY TYPE,/hk/item/N2612312001001,https://p-bandai.com/img/hk/p/t/N2612312001001_001.jpg
7,GUNDAM FIX FIGURATION METAL COMPOSITE WING GUNDAM EW Early Color ver.,/hk/item/N2590353001001,https://p-bandai.com/img/hk/p/t/N2590353001001_001.jpg
7,SAINT CLOTH MYTH EX GEMINI SAGA GOLD24,/hk/item/N2572550001001,https://p-bandai.com/img/hk/p/t/N2572550001001_001.jpg
7,METAL BUILD 10th Anniversary TRANS-AM RAISER Full Particle ver.,/hk/item/N2590591001001,https://p-bandai.com/img/hk/p/t/N2590591001001_001.jpg
7,S.H.Figuarts RISEHOPPER & RISING IMPACT EFFECT SET,/hk/item/N2606405001001,https://p-bandai.com/img/hk/p/t/N2606405001001_001.jpg
7,SAINT CLOTH MYTH EX ZETA ALCOR BUD,/hk/item/N2604490001001,https://p-bandai.com/img/hk/p/t/N2604490001001_001.jpg
7,METAL BUILD LOHENGRIN LAUNCHER,/hk/item/N2593475001001,https://p-bandai.com/img/hk/p/t/N2593475001001_001.jpg
7,THE ROBOT SPIRITS ＜SIDE MS＞ MSN-01 PSYCOMMU SYSTEM ZAKU ver. A.N.I.M.E. ,/hk/item/N2595913001001,https://p-bandai.com/img/hk/p/t/N2595913001001_001.jpg
7,METAL BUILD AILE STRIKER -METAL BUILD 10th Ver.-,/hk/item/N2586602001001,https://p-bandai.com/img/hk/p/t/N2586602001001_001.jpg
7,S.H.Figuarts (SHINKOCCHOUSEIHOU) MASKED RIDER KUUGA RISING ULTIMATE,/hk/item/N2566336001001,https://p-bandai.com/img/hk/p/t/N2566336001001_001.jpg
7,METAL BUILD STRIKE GUNDAM -METAL BUILD 10th Ver.-,/hk/item/N2586599001001,https://p-bandai.com/img/hk/p/t/N2586599001001_001.jpg
7,SAINT CLOTH MYTH EX GRIFFON MINOS -ORIGINAL COLOR EDITION-,/hk/item/N2587799001001,https://p-bandai.com/img/hk/p/t/N2587799001001_001.jpg
7,THE ROBOT SPIRITS ＜SIDE EVA＞ EVANGELION PRODUCTION MODEL-08γ,/hk/item/N2588064001001,https://p-bandai.com/img/hk/p/t/N2588064001001_001.jpg
7,HI-METAL R DRAGONAR‐2 CUSTOM,/hk/item/N2580902001001,https://p-bandai.com/img/hk/p/t/N2580902001001_001.jpg
7,METAL BUILD GUNDAM ASTRAEA TYPE-X FINSTERNIS,/hk/item/N2580356001001,https://p-bandai.com/img/hk/p/t/N2580356001001_001.jpg
7,S.H.Figuarts BEERUS -Event Exclusive Color Edition-,/hk/item/N2579810001001,https://p-bandai.com/img/hk/p/t/N2579810001001_001.jpg
7,S.H.Figuarts WHIS -Event Exclusive Color Edition-,/hk/item/N2579811001001,https://p-bandai.com/img/hk/p/t/N2579811001001_001.jpg
7,S.H.Figuarts SUPER SAIYAN GOD SON GOKU -Event Exclusive Color Edition-,/hk/item/N2579813001001,https://p-bandai.com/img/hk/p/t/N2579813001001_001.jpg
7,METAL BUILD STRIKE ROUGE ＋ OOTORI STRIKER,/hk/item/N2580351001001,https://p-bandai.com/img/hk/p/t/N2580351001001_012.jpg
7,S.H.Figuarts ULTRAMAN Z GAMMA FUTURE,/hk/item/N2572054001001,https://p-bandai.com/img/hk/p/t/N2572054001001_001.jpg
7,S.H.Figuarts KAMEN RIDER GRANDZI-O,/hk/item/N2518680001001,https://p-bandai.com/img/hk/p/t/N2518680001001_001.jpg
7,S.H.Figuarts ALPHAMON:OURYUKEN-Premium Color Edition-,/hk/item/N2572506001001,https://p-bandai.com/img/hk/p/t/N2572506001001_001.jpg
8,ROBOT SPIRITS ＜SIDE MS＞ MS-14F GELGOOG MARINE ver. A.N.I.M.E.,/hk/item/N2572056001001,https://p-bandai.com/img/hk/p/t/N2572056001001_001.jpg
8,S.H.Figuarts ULTRAMAN GEED GALAXY RISING,/hk/item/N2563101001001,https://p-bandai.com/img/hk/p/t/N2563101001001_001.jpg
8,ROBOT SPIRITS ＜SIDE MS＞ MS-06F-2 ZAKUII F2 KIMBERLITE BASE TYPE ver. A.N.I.M.E.,/hk/item/N2562625001001,https://p-bandai.com/img/hk/p/t/N2562625001001_001.jpg
8,ROBOT SPIRITS ＜SIDE MS＞ MS-09F/TROP DOM TROPEN KIMBERLITE BASE TYPE ver. A.N.I.M.E.,/hk/item/N2562624001001,https://p-bandai.com/img/hk/p/t/N2562624001001_001.jpg
8,PROPLICA Nichirin Sword (Kyojuro Rengoku),/hk/item/N2563006001001,https://p-bandai.com/img/hk/p/t/N2563006001001_001.jpg
8,S.H.Figuarts SC-1 SEVENGER,/hk/item/N2563100001001,https://p-bandai.com/img/hk/p/t/N2563100001001_001.jpg
8,S.H.Figuarts KAMEN RIDER ESPADA LAMP DO ALANGINA,/hk/item/N2563544001001,https://p-bandai.com/img/hk/p/t/N2563544001001_001.jpg
8,S.H.Figuarts JUGGLUS JUGGLER (NEW GENERATION EDITION),/hk/item/N2554974001001,https://p-bandai.com/img/hk/p/t/N2554974001001_001.jpg
8,S.H.Figuarts KAMEN RIDER CALIBUR JAAKU DRAGON,/hk/item/N2554976001001,https://p-bandai.com/img/hk/p/t/N2554976001001_001.jpg
8,SAINT CLOTH MYTH EX SAGITTARIUS SEIYA GOLD24,/hk/item/N2545640001001,https://p-bandai.com/img/hk/p/t/N2545640001001_001.jpg
8,METAL BUILD DESTINY GUNDAM SOUL RED Ver.,/hk/item/N2546651001001,https://p-bandai.com/img/hk/p/t/N2546651001001_001.jpg
8,METAL BUILD CROSSBONE GUNDAM X1 FULL CLOTH,/hk/item/N2548073001001,https://p-bandai.com/img/hk/p/t/N2548073001001_001.jpg
8,S.H.Figuarts MASKED RIDER DECADE COMPLETE FORM,/hk/item/N2547491001001,https://p-bandai.com/img/hk/p/t/N2547491001001_001.jpg
8,THE ROBOT SPIRITS ＜SIDE MS＞ MS-06F-2 ZAKUII F2 E.F.S.F. ver.A.N.I.M.E.,/hk/item/N2547938001001,https://p-bandai.com/img/hk/p/t/N2547938001001_001.jpg
8,METAL BUILD STRIKE FREEDOM GUNDAM WINGS OF LIGHT OPTION SET SOUL BLUE Ver.,/hk/item/N2548071001001,https://p-bandai.com/img/hk/p/t/N2548071001001_001.jpg
8,METAL STRUCTURE 解体匠機 RX-93 νGUNDAM OPTION PARTS LONDO BELL ENGINEERS,/hk/item/N2547490001001,https://p-bandai.com/img/hk/p/t/N2547490001001_001.jpg
8,ROBOT SPIRITS ＜SIDE MS＞ YMS-09R-2 PROTOTYPE RICK DOM ZWEI ver. A.N.I.M.E.,/hk/item/N2539458001001,https://p-bandai.com/img/hk/p/t/N2539458001001_001.jpg
8,S.H.Figuarts ULTRAMAN ZERO BEYOND（GALAXY GLITTER）,/hk/item/N2548030001001,https://p-bandai.com/img/hk/p/t/N2548030001001_001.jpg
8,S.H.Figuarts KAMEN RIDER JIN　BURNING FALCON,/hk/item/N2539284001001,https://p-bandai.com/img/hk/p/t/N2539284001001_001.jpg
8,THE ROBOT SPIRITS ＜SIDE MS＞ RX-0 Unicorn Gundam Perfectibility Divine,/hk/item/N2539456001001,https://p-bandai.com/img/hk/p/t/N2539456001001_001.jpg
8,Figuarts ZERO SUPER SAIYAN GOD SUPER SAIYAN VEGITO-Event Exclusive Color Edition-[2020年9月發送],/hk/item/N2530010001002,https://p-bandai.com/img/hk/p/t/N2530010001002_001.jpg
8,S.H.Figuarts ANDROID 17 -Event Exclusive Color Edition-,/hk/item/N2412659001001,https://p-bandai.com/img/hk/p/t/N2412659001001_001.jpg
8,S.H.Figuarts ANDROID 18 -Event Exclusive Color Edition-,/hk/item/N2412690001001,https://p-bandai.com/img/hk/p/t/N2412690001001_001.jpg
8,S.H.MonsterArts GODZILLA 【2019】 -Event Exclusive Color Edition-,/hk/item/N2516684001001,https://p-bandai.com/img/hk/p/t/N2516684001001_001.jpg
8,Tamashii Stage Dragon Ball -Event Exclusive Metallic Color Edition-  (7pcs set),/hk/item/N2529968001001,https://p-bandai.com/img/hk/p/t/N2529968001001_001.jpg
8,Figuarts ZERO SUPER SAIYAN BROLY-THE BURNING BATTLE- -Event Exclusive Color Edition-,/hk/item/N2529969001001,https://p-bandai.com/img/hk/p/t/N2529969001001_001.jpg
8,Figuarts ZERO SUPER SAIYAN GOD SUPER SAIYAN VEGITO-Event Exclusive Color Edition-,/hk/item/N2530010001001,https://p-bandai.com/img/hk/p/t/N2530010001001_001.jpg
8,"S.H.Figuarts SON GOKU Ultra Instinct ""Sign"" -Event Exclusive Color Edition-",/hk/item/N2492385001001,https://p-bandai.com/img/hk/p/t/N2492385001001_001.jpg
8,METAL BUILD SWORD STRIKER,/hk/item/N2539317001001,https://p-bandai.com/img/hk/p/t/N2539317001001_001.jpg
8,S.H.Figuarts KAMEN RIDER EVOL BLACK HOLE FORM (PHASE 4),/hk/item/N2532426001001,https://p-bandai.com/img/hk/p/t/N2532426001001_001.jpg
8,S.H.Figuarts KAMEN RIDER VULCAN ASSAULT WOLF,/hk/item/N2533151001001,https://p-bandai.com/img/hk/p/t/N2533151001001_001.jpg
8,S.H.Figuarts KAMEN RIDER ZEROZERO-ONE,/hk/item/N2533150001001,https://p-bandai.com/img/hk/p/t/N2533150001001_001.jpg
9,S.H.Figuarts KAMEN RIDER THOUSER,/hk/item/N2533152001001,https://p-bandai.com/img/hk/p/t/N2533152001001_001.jpg
9,METAL BUILD LAUNCHER STRIKER,/hk/item/N2526186001001,https://p-bandai.com/img/hk/p/t/N2526186001001_001.jpg
9,METAL BUILD AILE STRIKER,/hk/item/N2533323001001,https://p-bandai.com/img/hk/p/t/N2533323001001_001.jpg
9,S.H.Figuarts (SHINKOCCHOUSEIHOU) MASKED RIDER DEN-O PLAT FORM,/hk/item/N2526170001001,https://p-bandai.com/img/hk/p/t/N2526170001001_001.jpg
9,METAL BUILD EVA-01 TEST TYPE [EVA2020],/hk/item/N2516615001001,https://p-bandai.com/img/hk/p/t/N2516615001001_001.jpg
9,S.H.Figuarts Super Saiyan God Super Saiyan Vegito -Super-,/hk/item/N2507787001001,https://p-bandai.com/img/hk/p/t/N2507787001001_001.jpg
9,SAINT CLOTH MYTH CROW JAMIAN,/hk/item/N2525723001001,https://p-bandai.com/img/hk/p/t/N2525723001001_001.jpg
9,THE ROBOT SPIRITS ＜SIDE MS＞ RGC-83 GM CANNON II ver. A.N.I.M.E.,/hk/item/N2524775001001,https://p-bandai.com/img/hk/p/t/N2524775001001_001.jpg
9,SAINT CLOTH MYTH EX SEA HORSE BYAN,/hk/item/N2525722001001,https://p-bandai.com/img/hk/p/t/N2525722001001_001.jpg
9,METAL ROBOT SPIRITS ＜SIDE MS＞ AKATSUKI GUNDAM(SHIRANUI UNIT),/hk/item/N2525728001001,https://p-bandai.com/img/hk/p/t/N2525728001001_001.jpg
9,S.H.Figuarts KAMEN RIDER ZERO-ONE SHINING ASSAULT HOPPER,/hk/item/N2525720001001,https://p-bandai.com/img/hk/p/t/N2525720001001_001.jpg
9,METAL BUILD GUNDAM EXIA REPAIR IV,/hk/item/N2475381001001,https://p-bandai.com/img/hk/p/t/N2475381001001_001.jpg
9,THE ROBOT SPIRITS ＜SIDE MS＞ RGM-79 POWERED GM ver. A.N.I.M.E.,/hk/item/N2516430001001,https://p-bandai.com/img/hk/p/t/N2516430001001_001.jpg
9,S.H.Figuarts KAMEN RIDER ZI-O TRINITY,/hk/item/N2516639001001,https://p-bandai.com/img/hk/p/t/N2516639001001_001.jpg
9,THE ROBOT SPIRITS ＜SIDE MS＞ MS-06R-1A ZAKU II HIGH MOBILITY TYPE SHIN MATSUNAGA'S CUSTOM MODEL ver. A.N.I.M.E.,/hk/item/N2516435001001,https://p-bandai.com/img/hk/p/t/N2516435001001_001.jpg
9,S.H.Figuarts KAMEN RIDER JIN FLYING FALCON,/hk/item/N2518681001001,https://p-bandai.com/img/hk/p/t/N2518681001001_001.jpg
9,S.H.Figuarts KAMEN RIDER BUILD TRIAL FORM RABBITDRAGON,/hk/item/N2470645001001,https://p-bandai.com/img/hk/p/t/N2470645001001_001.jpg
9,S.H.Figuarts (SHINKOCCHOUSEIHOU) MASKED RIDER DIEND,/hk/item/N2489913001001,https://p-bandai.com/img/hk/p/t/N2489913001001_001.jpg
9,S.H.Figuarts STRONG CORONA ZERO & LUNA MIRACLE ZERO,/hk/item/N2492386001001,https://p-bandai.com/img/hk/p/t/N2492386001001_001.jpg
9,THE ROBOT SPIRITS ＜SIDE MS＞ MS-09R RICK DOM ver. A.N.I.M.E. -Real Type Color-,/hk/item/N2492489001001,https://p-bandai.com/img/hk/p/t/N2492489001001_001.jpg
9,THE ROBOT SPIRITS ＜SIDE MS＞ MS-14A GELGOOG ver. A.N.I.M.E. -FIRST TOUCH 3500-,/hk/item/N2492520001001,https://p-bandai.com/img/hk/p/t/N2492520001001_001.jpg
9,METAL BUILD 00-RAISER DESIGNER'S BLUE Ver. ,/hk/item/N2498420001001,https://p-bandai.com/img/hk/p/t/N2498420001001_001.jpg
9,SAINT CLOTH MYTH ALRAUNE QUEEN,/hk/item/N2455585001001,https://p-bandai.com/img/hk/p/t/N2455585001001_001.jpg
9,S.H.Figuarts (SHINKOCCHOUSEIHOU) KAMEN RIDER OOO GATAKIRIBA COMBO,/hk/item/N2499683001001,https://p-bandai.com/img/hk/p/t/N2499683001001_001.jpg
9,SAINT CLOTH MYTH EX LIBRA SHIRYU,/hk/item/N2455581001001,https://p-bandai.com/img/hk/p/t/N2455581001001_001.jpg
9,S.H.Figuarts KAMEN RIDER GEIZREVIVE TRUE SAVIOR SET,/hk/item/N2492264001001,https://p-bandai.com/img/hk/p/t/N2492264001001_001.jpg
9,THE ROBOT SPIRITS ＜SIDE MS＞ YMS-16M XAMEL ver. A.N.I.M.E.,/hk/item/N2492486001001,https://p-bandai.com/img/hk/p/t/N2492486001001_001.jpg
9,S.H.Figuarts KAMEN RIDER EVOL (PHASE 1. 2. 3. SET),/hk/item/N2470608001001,https://p-bandai.com/img/hk/p/t/N2470608001001_001.jpg
9,THE ROBOT SPIRITS ＜SIDE MS＞ RGM-79GS GM COMMAND SPACE ver. A.N.I.M.E.,/hk/item/N2486645001001,https://p-bandai.com/img/hk/p/t/N2486645001001_001.jpg
9,METAL BUILD CALETVWLCH OPTION SET,/hk/item/N2492453001001,https://p-bandai.com/img/hk/p/t/N2492453001001_001.jpg
9,METAL BUILD FLIGHT UNIT OPTION SET (ALTERNATIVE STRIKE Ver.),/hk/item/N2492454001001,https://p-bandai.com/img/hk/p/t/N2492454001001_001.jpg
9,METAL BUILD CROSSBONE GUNDAM X2,/hk/item/N2469103001001,https://p-bandai.com/img/hk/p/t/N2469103001001_001.jpg
10,S.H.Figuarts (SHINKOCCHOUSEIHOU) OUGONKISHI GARO (SAEJIMA RAIGA),/hk/item/N2484712001001,https://p-bandai.com/img/hk/p/t/N2484712001001_001.jpg
10,METAL ROBOT SPIRITS ＜SIDE MS＞ AKATSUKI GUNDAM (OOWASHI unit),/hk/item/N2484817001001,https://p-bandai.com/img/hk/p/t/N2484817001001_001.jpg
10,THE ROBOT SPIRITS ＜SIDE MS＞ RX-77-3 GUNCANNON HEAVY CUSTOM ver. A.N.I.M.E.,/hk/item/N2486643001001,https://p-bandai.com/img/hk/p/t/N2486643001001_001.jpg
10,SAINT CLOTH MYTH EX CHRYSAOR KRISHNA,/hk/item/N2475341001001,https://p-bandai.com/img/hk/p/t/N2475341001001_001.jpg
10,S.H.Figuarts MACHINE KIVAA OPTIONPARTS SET,/hk/item/N2476923001001,https://p-bandai.com/img/hk/p/t/N2476923001001_001.jpg
10,THE ROBOT SPIRITS ＜SIDE MS＞ YMS-09D DOM TROPICAL TEST TYPE ver. A.N.I.M.E.,/hk/item/N2475348001001,https://p-bandai.com/img/hk/p/t/N2475348001001_001.jpg
10,METAL BUILD STRIKE GUNDAM,/hk/item/N2486322001001,https://p-bandai.com/img/hk/p/t/N2486322001001_001.jpg
10,SAINT CLOTH MYTH EX Aries Shion (Surplice),/hk/item/N2455587001001,https://p-bandai.com/img/hk/p/t/N2455587001001_001.jpg
10,METAL ROBOT SPIRITS ＜SIDE MS＞ KNIGHT GUNDAM (Real type ver.) ～LACROAN HERO～,/hk/item/N2466350001001,https://p-bandai.com/img/hk/p/t/N2466350001001_001.jpg
10,S.H.Figuarts KAMEN RIDER AMAZONS SAIGO NO SHINPAN SET[2019年7月發送],/hk/item/N2470647001002,https://p-bandai.com/img/hk/p/t/N2470647001002_001.jpg
10,METAL BUILD GUNDAM ASTRAEA＋PROTO GN HIGH MEGA LAUNCHER【Second Offer】,/hk/item/N2444492001002,https://p-bandai.com/img/hk/p/t/N2444492001002_001.jpg
10,SAINT CLOTH MYTH FIRE CLOCK OF THE SANCTUARY,/hk/item/N2455584001001,https://p-bandai.com/img/hk/p/t/N2455584001001_001.jpg
10,THE ROBOT SPIRITS ＜SIDE MS＞ FF-X7-Bst CORE BOOSTER TWO SET ver. A.N.I.M.E.～SLEGGAR 005＆SAYLA 006～,/hk/item/N2466346001001,https://p-bandai.com/img/hk/p/t/N2466346001001_001.jpg
10,S.H.Figuarts RIDESTRIKER & ZIKAN GIRADE / ZIKAN ZAX SET,/hk/item/N2461815001001,https://p-bandai.com/img/hk/p/t/N2461815001001_001.jpg
10,THE ROBOT SPIRITS ＜SIDE MS＞ RX-78NT-1FA GUNDAM NT-1 ver. A.N.I.M.E. -FULL ARMOR EQUIPMENT-,/hk/item/N2459205001001,https://p-bandai.com/img/hk/p/t/N2459205001001_001.jpg
10,METAL BUILD STRIKE FREEDOM GUNDAM SOUL BLUE Ver.【Second Offer】,/hk/item/N2447901001002,https://p-bandai.com/img/hk/p/t/N2447901001002_001.jpg
10,Saint Cloth Myth EX GEMINI SAGA KANON -ORIGINAL COLOR EDITION-【Second Offer】,/hk/item/N2447905001002,https://p-bandai.com/img/hk/p/t/N2447905001002_001.jpg
10,METAL BUILD STRIKE FREEDOM GUNDAM SOUL BLUE Ver.,/hk/item/N2447901001001,https://p-bandai.com/img/hk/p/t/N2447901001001_001.jpg
10,THE ROBOT SPIRITS ＜SIDE MS＞ MS-06 ZAKU II ver. A.N.I.M.E. -FIRST TOUCH 2500-,/hk/item/N2447906001001,https://p-bandai.com/img/hk/p/t/N2447906001001_001.jpg
10,SAINT CLOTH MYTH EX Aquarius Hyoga,/hk/item/N2451267001001,https://p-bandai.com/img/hk/p/t/N2451267001001_001.jpg
10,S.H.Figuarts(SHINKOCCHOUSEIHOU) MASKED RIDER ZANKI,/hk/item/N2428262001001,https://p-bandai.com/img/hk/p/t/N2428262001001_001.jpg
10,THE ROBOT SPIRITS ＜SIDE MS＞ NIGHTINGALE (heavy paint specification),/hk/item/N2444494001001,https://p-bandai.com/img/hk/p/t/N2444494001001_001.jpg
10,Saint Cloth Myth EX PISCES APHRODITE (SURPLICE),/hk/item/N2428059001001,https://p-bandai.com/img/hk/p/t/N2428059001001_001.jpg
10,METAL ROBOT SPIRITS (Ka signature) ＜SIDE MS＞ S GUNDAM Option Parts BOOSTER UNIT,/hk/item/N2444405001001,https://p-bandai.com/img/hk/p/t/N2444405001001_008.jpg
10,THE ROBOT SPIRITS 〈SIDE MS〉 MSN-02 ZEONG ver. A.N.I.M.E.,/hk/item/N2443383001001,https://p-bandai.com/img/hk/p/t/N2443383001001_001.jpg
10,S.H.Figuarts (SHINKOCCHOUSEIHOU) KAMEN RIDER DOUBLE HEATMETAL,/hk/item/N2369414001001,https://p-bandai.com/img/hk/p/t/N2369414001001_001.jpg
10,METAL BUILD GUNBARREL STRIKER,/hk/item/N2444491001001,https://p-bandai.com/img/hk/p/t/N2444491001001_001.jpg
10,METAL BUILD GERNSBACK Ver.IV,/hk/item/N2444489001001,https://p-bandai.com/img/hk/p/t/N2444489001001_011.jpg
10,SOUL OF CHOGOKIN GX-72B MEGAZORD (BLACK VERSION),/hk/item/N2419207001001,https://p-bandai.com/img/hk/p/t/N2419207001001_011.jpg
10,Saint Cloth Myth EX KRAKEN ISAAC,/hk/item/N2444500001001,https://p-bandai.com/img/hk/p/t/N2444500001001_001.jpg
10,SDX RYUKI DRAGOON,/hk/item/N2426047001001,https://p-bandai.com/img/hk/p/t/N2426047001001_001.jpg
10,S.H.Figuarts (SHINKOCCHOUSEIHOU)  ZERO,/hk/item/N2438330001001,https://p-bandai.com/img/hk/p/t/N2438330001001_001.jpg
11,THE ROBOT SPIRITS 〈SIDE MS〉 MS-14B GELGOOG HIGH MOBILITY TYPE JOHNNY RIDDEN’S CUSTOM MODEL ver. A.N.I.M.E.,/hk/item/N2432834001001,https://p-bandai.com/img/hk/p/t/N2432834001001_001.jpg
11,S.H.Figuarts(SHINKOCCHOUSEIHOU) KAMEN RIDER DOUBLE LUNATRIGGER,/hk/item/N2369415001001,https://p-bandai.com/img/hk/p/t/N2369415001001_001.jpg
11,THE ROBOT SPIRITS 〈SIDE MS〉 MS-06J ZAKU II WETLAND TYPE ver. A.N.I.M.E.,/hk/item/N2432833001001,https://p-bandai.com/img/hk/p/t/N2432833001001_001.jpg
11,Saint Cloth Myth EX GARUDA AIACOS,/hk/item/N2437356001001,https://p-bandai.com/img/hk/p/t/N2437356001001_001.jpg
11,METAL BUILD GUNDAM ASTRAEA TYPE-F “AVALUNG’”OP-SET,/hk/item/N2438384001001,https://p-bandai.com/img/hk/p/t/N2438384001001_001.jpg
11,S.H.Figuarts CROW AMAZON,/hk/item/N2432804001001,https://p-bandai.com/img/hk/p/t/N2432804001001_001.jpg
11,S.H.Figuarts KAMEN RIDER AMAZON NEO ALFA,/hk/item/N2432805001001,https://p-bandai.com/img/hk/p/t/N2432805001001_001.jpg
11,SOUL OF CHOGOKIN GX-76X2 GRENDIZER D.C. DRILL SPAZER & MARINE SPAZER SET,/hk/item/N2438440001001,https://p-bandai.com/img/hk/p/t/N2438440001001_001.jpg
11,THE ROBOT SPIRITS 〈SIDE MS〉 BANSHEE NORN SP PACK [REAL MARKING Ver.],/hk/item/N2428150001001,https://p-bandai.com/img/hk/p/t/N2428150001001_001.jpg
11,"Figuarts Zero chouette SAILOR MOON-Moon Crystal Power, Make Up-",/hk/item/N2428057001001,https://p-bandai.com/img/hk/p/t/N2428057001001_001.jpg
11,METAL ROBOT SPIRITS (Ka signature) 〈SIDE MS〉 S GUNDAM,/hk/item/N2428105001001,https://p-bandai.com/img/hk/p/t/N2428105001001_001.jpg
11,Figuarts Zero Corazon,/hk/item/N2437803001001,https://p-bandai.com/img/hk/p/t/N2437803001001_001.jpg
11,METAL ROBOT SPIRITS 〈SIDE MS〉 WING OF LIGHT ＆ Hi-MAT FULL BURST EFFECT SET,/hk/item/N2438352001001,https://p-bandai.com/img/hk/p/t/N2438352001001_001.jpg
11,SOFVI SPIRITS HAKUJA,/hk/item/N2403521001001,https://p-bandai.com/img/hk/p/t/N2403521001001_001.jpg
11,SOFVI SPIRITS SHRIKETHORN,/hk/item/N2403522001001,https://p-bandai.com/img/hk/p/t/N2403522001001_001.jpg
11,TAMASHII Lab MASKED RIDER BLACK RX REVOLCANE,/hk/item/N2424678001001,https://p-bandai.com/img/hk/p/t/N2424678001001_001.jpg
11,Saint Cloth Myth EX LIBRA DOHKO & Master Roshi -ORIGINAL COLOR EDITION-,/hk/item/N2428058001001,https://p-bandai.com/img/hk/p/t/N2428058001001_001.jpg
11,METAL ROBOT SPIRITS 〈SIDE MS〉 ∞ JUSTICE GUNDAM,/hk/item/N2428106001001,https://p-bandai.com/img/hk/p/t/N2428106001001_001.jpg
11,S.H.Figuarts(SHINKOCCHOUSEIHOU) MASKED RIDER IBUKI,/hk/item/N2428095001001,https://p-bandai.com/img/hk/p/t/N2428095001001_001.jpg
11,PROPLICA Sailor Chibi Moon Prism Heart Compact,/hk/item/N2419147001001,https://p-bandai.com/img/hk/p/t/N2419147001001_001.jpg
11,12 Perfect Model BARNABY BROOKS Jr. -Casual style-,/hk/item/N2424023001001,https://p-bandai.com/img/hk/p/t/N2424023001001_001.jpg
11,Saint Cloth Myth CERBERUS DANTE,/hk/item/N2419188001001,https://p-bandai.com/img/hk/p/t/N2419188001001_001.jpg
11,SOUL OF CHOGOKIN GX-80 N-NAUTILUS,/hk/item/N2294306001001,https://p-bandai.com/img/hk/p/t/N2294306001001_001.jpg
11,S.H.Figuarts SHOCKER COMBATMAN (BLACK),/hk/item/N2412421001001,https://p-bandai.com/img/hk/p/t/N2412421001001_001.jpg
11,S.H.Figuarts GEL SHOCKER COMBATMAN,/hk/item/N2412423001001,https://p-bandai.com/img/hk/p/t/N2412423001001_001.jpg
11,S.I.C. KAMEN RIDER GAIM ICHIGO ARMS,/hk/item/N2419773001001,https://p-bandai.com/img/hk/p/t/N2419773001001_001.jpg
11,FiguartsZERO Sanji -Whole cake island Ver.-,/hk/item/N2403866001001,https://p-bandai.com/img/hk/p/t/N2403866001001_001.jpg
11,PROPLICA Transformation Lip Rod Sailor Uranus,/hk/item/N2419148001001,https://p-bandai.com/img/hk/p/t/N2419148001001_001.jpg
11,PROPLICA Transformation Lip Rod Sailor Neptune,/hk/item/N2419149001001,https://p-bandai.com/img/hk/p/t/N2419149001001_001.jpg
11,THE ROBOT SPIRITS 〈SIDE MS〉 MS-09R RICK DOM & RB-79 BALL ver. A.N.I.M.E.,/hk/item/N2419200001001,https://p-bandai.com/img/hk/p/t/N2419200001001_001.jpg
11,METAL ROBOT SPIRITS 〈SIDE MS〉 MUSHA GUNDAM,/hk/item/N2419203001001,https://p-bandai.com/img/hk/p/t/N2419203001001_001.jpg
