page,name,shop_product_code,img_url
11,THE ROBOT SPIRITS 〈SIDE MS〉 RB-79 BALL ver. A.N.I.M.E.,/hk/item/N2421247001001,https://p-bandai.com/img/hk/p/t/N2421247001001_001.jpg
12,Saint Cloth Myth The Sun God Abel,/hk/item/N2413812001001,https://p-bandai.com/img/hk/p/t/N2413812001001_001.jpg
12,Saint Cloth Myth The Sun God Abel and Goddess Athena Legend of Crimson Youth memorial set,/hk/item/N2413813001001,https://p-bandai.com/img/hk/p/t/N2413813001001_001.jpg
12,THE ROBOT SPIRITS (Ka signature) 〈SIDE MS〉 GUNDAM Mk-II TITANS,/hk/item/N2413980001001,https://p-bandai.com/img/hk/p/t/N2413980001001_001.jpg
12,【Set of 2】THE ROBOT SPIRITS (Ka signature) 〈SIDE MS〉 GUNDAM Mk-II TITANS (With special parts accessories),/hk/item/N9022870001001,https://p-bandai.com/img/hk/p/t/N9022870001001_001.jpg
12,S.H.Figuarts SUPER SAILORVENUS,/hk/item/N2403910001001,https://p-bandai.com/img/hk/p/t/N2403910001001_001.jpg
12,GANSO SD GUNDAM WORLD Kage Kikoushin Chaos Gaiaer,/hk/item/N2411948001001,https://p-bandai.com/img/hk/p/t/N2411948001001_001.jpg
12,S.H.Figuarts MACHINE BUILDER & PARTS SET,/hk/item/N2419776001001,https://p-bandai.com/img/hk/p/t/N2419776001001_001.jpg
12,THE ROBOT SPIRITS 〈SIDE MS〉 SINANJU [REAL MARKING Ver.],/hk/item/N2419811001001,https://p-bandai.com/img/hk/p/t/N2419811001001_001.jpg
12,THE ROBOT SPIRITS 〈SIDE MS〉 SINANJU FINAL BATTLE SET :Feat.NEO ZEONG,/hk/item/N2419812001001,https://p-bandai.com/img/hk/p/t/N2419812001001_001.jpg
12,METAL ROBOT SPIRITS (Ka signature) 〈SIDE OG〉 HUCKEBEIN,/hk/item/N2428104001001,https://p-bandai.com/img/hk/p/t/N2428104001001_001.jpg
12,S.H.Figuarts（SHINKOCCHOUSEIHOU） KAMEN RIDER JOKER,/hk/item/N2369412001001,https://p-bandai.com/img/hk/p/t/N2369412001001_001.jpg
12,S.I.C. KAMEN RIDER GAIM KACHIDOKI ARMS,/hk/item/N2391167001001,https://p-bandai.com/img/hk/p/t/N2391167001001_001.jpg
12,Saint Cloth Myth EX THE 13TH GOLD SAINT -ORIGINAL COLOR EDITION-,/hk/item/N2396556001001,https://p-bandai.com/img/hk/p/t/N2396556001001_001.jpg
12,METAL BUILD GUNDAM FORMULA 91 (HARRISON MADDIN CUSTOM),/hk/item/N2396557001001,https://p-bandai.com/img/hk/p/t/N2396557001001_001.jpg
12,SOUL OF CHOGOKIN GX-70CN MAZINGER Z D.C. CHROME NOIR,/hk/item/N2396558001001,https://p-bandai.com/img/hk/p/t/N2396558001001_001.jpg
12,THE ROBOT SPIRITS 〈SIDE MS〉 RX-78-2 GUNDAM ver. A.N.I.M.E. -FIRST TOUCH 2500-,/hk/item/N2397010001001,https://p-bandai.com/img/hk/p/t/N2397010001001_001.jpg
12,NXEDGE STYLE [MS UNIT] GHOST GUNDAM,/hk/item/N2413861001001,https://p-bandai.com/img/hk/p/t/N2413861001001_001.jpg
12,THE ROBOT SPIRITS 〈SIDE MS〉 RX-75-4 GUNTANK & CORE FIGHTER LAUNCHING PARTS ver. A.N.I.M.E.,/hk/item/N2413987001001,https://p-bandai.com/img/hk/p/t/N2413987001001_001.jpg
12,S.H.Figuarts (SHINKOCCHOUSEIHOU) OUGONKISHI GARO (SAEJIMA KOGA),/hk/item/N2325079001001,https://p-bandai.com/img/hk/p/t/N2325079001001_001.jpg
12,METAL BUILD GUNDAM ASTRAEA TYPE-F (GN HEAVY WEAPON SET) [2018年7月發送],/hk/item/N2413859001002,https://p-bandai.com/img/hk/p/t/N2413859001002_001.jpg
12,METAL BUILD GUNDAM ASTRAEA TYPE-F (GN HEAVY WEAPON SET),/hk/item/N2413859001001,https://p-bandai.com/img/hk/p/t/N2413859001001_001.jpg
12,S.H.Figuarts ALIEN ZARAB,/hk/item/N2411835001001,https://p-bandai.com/img/hk/p/t/N2411835001001_001.jpg
12,THE ROBOT SPIRITS 〈SIDE KMF〉 SUTHERLAND Purebloods type & Standard type parts set,/hk/item/N2413982001001,https://p-bandai.com/img/hk/p/t/N2413982001001_001.jpg
12,Super Robot Chogokin GURREN LAGANN 10th ANNIVERSARY SET,/hk/item/N2413957001001,https://p-bandai.com/img/hk/p/t/N2413957001001_001.jpg
12,METAL BUILD GUNDAM EXIA (10th ANNIVERSARY EDITION),/hk/item/N2395878001001,https://p-bandai.com/img/hk/p/t/N2395878001001_001.jpg
12,ARMOR GIRLS PROJECT MS GIRL FAZZ,/hk/item/N2404978001001,https://p-bandai.com/img/hk/p/t/N2404978001001_001.jpg
12,Saint Cloth Myth EX Griffon Minos,/hk/item/N2271370001001,https://p-bandai.com/img/hk/p/t/N2271370001001_001.jpg
12,S.I.C. KAMEN RIDER ZANGETSU JIMBER MELON ARMS,/hk/item/N2404960001001,https://p-bandai.com/img/hk/p/t/N2404960001001_001.jpg
12,S.H.Figuarts KAMEN RIDER AMAZON ALFA (2nd Season Ver.),/hk/item/N2404958001001,https://p-bandai.com/img/hk/p/t/N2404958001001_001.jpg
12,METAL ROBOT SPIRITS 〈SIDE MS〉 XN RAISER + SEVEN SWORD PARTS SET,/hk/item/N2404972001001,https://p-bandai.com/img/hk/p/t/N2404972001001_001.jpg
12,THE ROBOT SPIRITS 〈SIDE MS〉 CROSSBONE GUNDAM X-0,/hk/item/N2271473001001,https://p-bandai.com/img/hk/p/t/N2271473001001_001.jpg
12,S.H.Figuarts RAINBOW MIKA,/hk/item/N2395894001001,https://p-bandai.com/img/hk/p/t/N2395894001001_001.jpg
13,S.H.Figuarts MASKED RIDER KABUTO HYPER FORM,/hk/item/N2403460001001,https://p-bandai.com/img/hk/p/t/N2403460001001_001.jpg
13,THE ROBOT SPIRITS 〈SIDE MS〉 MS-14A GELGOOG & C-TYPE EQUIPMENT ver. A.N.I.M.E.,/hk/item/N2404975001001,https://p-bandai.com/img/hk/p/t/N2404975001001_001.jpg
13,GUNDAM FIX FIGURATION METAL COMPOSITE WING GUNDAM ZERO (Endless Waltz Ver.),/hk/item/N2397044001001,https://p-bandai.com/img/hk/p/t/N2397044001001_001.jpg
13,FiguartsZERO ANKOKU DAISHOGUN D.C.,/hk/item/N2404968001001,https://p-bandai.com/img/hk/p/t/N2404968001001_001.jpg
13,THE ROBOT SPIRITS 〈SIDE LABOR〉 INGRAM 3rd,/hk/item/N2395871001001,https://p-bandai.com/img/hk/p/t/N2395871001001_001.jpg
13,GANSO SD GUNDAM WORLD FIVE KIKOUSHIN SET,/hk/item/N2395875001001,https://p-bandai.com/img/hk/p/t/N2395875001001_001.jpg
13,THE ROBOT SPIRITS 〈SIDE MS〉 MS-06F ZAKU MINE LAYER ver. A.N.I.M.E.,/hk/item/N2404977001001,https://p-bandai.com/img/hk/p/t/N2404977001001_001.jpg
13,S.H.Figuarts SON GOKOU KAIOHKEN Ver.,/hk/item/N2382996001001,https://p-bandai.com/img/hk/p/t/N2382996001001_001.jpg
13,SAINT CLOTH MYTH GODDESS ATHENA -ORIGINAL COLOR EDITION-,/hk/item/N2383000001001,https://p-bandai.com/img/hk/p/t/N2383000001001_001.jpg
13,S.H.Figuarts BODY-KUN WORLD TOUR Ver.,/hk/item/N2382997001001,https://p-bandai.com/img/hk/p/t/N2382997001001_001.jpg
13,S.H.Figuarts BODY-CHAN WORLD TOUR Ver.,/hk/item/N2382998001001,https://p-bandai.com/img/hk/p/t/N2382998001001_001.jpg
13,TAMASHII STAGE WORLD TOUR Ver.,/hk/item/N2382999001001,https://p-bandai.com/img/hk/p/t/N2382999001001_001.jpg
13,SUPER ROBOT CHOGOKIN SHIN MAZINGER Z GOLD Ver.,/hk/item/N2383013001001,https://p-bandai.com/img/hk/p/t/N2383013001001_001.jpg
13,DARUMA CLUB WORLD TOUR Ver.,/hk/item/N2383014001001,https://p-bandai.com/img/hk/p/t/N2383014001001_001.jpg
13,THE ROBOT SPIRITS 〈SIDE MS〉 MS-06 ZAKUII MASS PRODUCTION MODEL ver. A.N.I.M.E. -Real Type Color-,/hk/item/N2383015001001,https://p-bandai.com/img/hk/p/t/N2383015001001_001.jpg
13,SAINT CLOTH MYTH APPENDIX GOLD CLOTH OBJECT SET,/hk/item/A2383001001001,https://p-bandai.com/img/hk/p/t/A2383001001001_001.jpg
13,METAL ROBOT SPIRITS (Ka signature) 〈SIDE MS〉 Ex-S GUNDAM TASK FORCE α,/hk/item/N2395877001001,https://p-bandai.com/img/hk/p/t/N2395877001001_001.jpg
13,FiguartsZERO Sailor Pluto -Pretty Guardian Sailor Moon Crystal-,/hk/item/N2395852001001,https://p-bandai.com/img/hk/p/t/N2395852001001_001.jpg
13,S.H.Figuarts Super Sailor Jupiter,/hk/item/N2382815001001,https://p-bandai.com/img/hk/p/t/N2382815001001_001.jpg
13,METAL BUILD GN SWORD II BLASTER,/hk/item/N2395891001001,https://p-bandai.com/img/hk/p/t/N2395891001001_001.jpg
13,THE ROBOT SPIRITS <SIDE MS> RGM-79SC GM SNIPER CUSTOM ver. A.N.I.M.E.,/hk/item/N2395858001001,https://p-bandai.com/img/hk/p/t/N2395858001001_001.jpg
13,ROBOT SPIRITS 〈SIDE MS〉 MS-06M ZAKU MARINE TYPE ver. A.N.I.M.E.,/hk/item/N2390189001001,https://p-bandai.com/img/hk/p/t/N2390189001001_001.jpg
13,Soul of Chogokin GX-70D MAZINGER Z D.C. Damaged ver.,/hk/item/N2391158001001,https://p-bandai.com/img/hk/p/t/N2391158001001_001.jpg
13,SUPER ROBOT CHOGOKIN GREAT MAZINKAISER,/hk/item/N2391163001001,https://p-bandai.com/img/hk/p/t/N2391163001001_001.jpg
13,PROPLICA PINK MOON STICK,/hk/item/N2364907001001,https://p-bandai.com/img/hk/p/t/N2364907001001_001.jpg
13,SDX Sun Knight God Gundam,/hk/item/N2390585001001,https://p-bandai.com/img/hk/p/t/N2390585001001_001.jpg
13,S.I.C. HEART ROIDMUDE,/hk/item/N2334600001001,https://p-bandai.com/img/hk/p/t/N2334600001001_001.jpg
13,ULTRA-ACT x S.H.Figuarts ULTRAMAN Limiter Release Ver.,/hk/item/N2381785001001,https://p-bandai.com/img/hk/p/t/N2381785001001_001.jpg
13,ROBOT SPIRITS 〈SIDE MS〉 RGC-80 GM CANNON ver. A.N.I.M.E.,/hk/item/N2382456001001,https://p-bandai.com/img/hk/p/t/N2382456001001_001.jpg
13,S.I.C. KAMEN RIDER GAIM JIMBER LEMON ARMS,/hk/item/N2382521001001,https://p-bandai.com/img/hk/p/t/N2382521001001_001.jpg
13,S.H.Figuarts KAMEN RIDER BRAVE HUNTER QUEST GAMER LEVEL5,/hk/item/N2382864001001,https://p-bandai.com/img/hk/p/t/N2382864001001_001.jpg
13,S.H.Figuarts KAMEN RIDER SNIPE HUNTER SHOOTING GAMER LEVEL5,/hk/item/N2382865001001,https://p-bandai.com/img/hk/p/t/N2382865001001_001.jpg
14,Saint Cloth Myth EX Aquarius Camus (Surplice),/hk/item/N2382450001001,https://p-bandai.com/img/hk/p/t/N2382450001001_001.jpg
14,Saint Cloth Myth EX Broken Suplice Parts Set,/hk/item/N2382451001001,https://p-bandai.com/img/hk/p/t/N2382451001001_001.jpg
14,Figuarts ZERO Sailor Saturn -Pretty Guardian Sailor Moon Crystal-,/hk/item/N2382469001001,https://p-bandai.com/img/hk/p/t/N2382469001001_001.jpg
14,S.H.Figuarts SUPER SAILOR MARS,/hk/item/N2382814001001,https://p-bandai.com/img/hk/p/t/N2382814001001_001.jpg
14,S.H.Figuarts MOLE AMAZON,/hk/item/N2390906001001,https://p-bandai.com/img/hk/p/t/N2390906001001_001.jpg
14,ROBOT SPIRITS 〈SIDE MS〉 UNICORN GUNDAM 03 PHENEX type RC (DESTROY MODE),/hk/item/N2379230001001,https://p-bandai.com/img/hk/p/t/N2379230001001_001.jpg
14,S.H.Figuarts KAMEN RIDER DARK DRIVE type NEXT,/hk/item/N2382862001001,https://p-bandai.com/img/hk/p/t/N2382862001001_001.jpg
14,S.H.Figuarts KAMEN RIDER LAZER BIKE GAMER LEVEL 2,/hk/item/N2382863001001,https://p-bandai.com/img/hk/p/t/N2382863001001_001.jpg
14,S.H.MonsterArts MOTHRA（Adult form）& MOTHRA（Larval form） Special Color Ver.,/hk/item/N2381822001001,https://p-bandai.com/img/hk/p/t/N2381822001001_001.jpg
14,METAL BUILD GUNDAM F91 MSV OPTION SET,/hk/item/N2382522001001,https://p-bandai.com/img/hk/p/t/N2382522001001_001.jpg
14,S.H.Figuarts MASKED RIDER KICK HOPPER,/hk/item/N2378517001001,https://p-bandai.com/img/hk/p/t/N2378517001001_001.jpg
14,S.H.Figuarts MASKED RIDER PUNCH HOPPER,/hk/item/N2378518001001,https://p-bandai.com/img/hk/p/t/N2378518001001_001.jpg
14,METAL BUILD GUNDAM ASTRAY RED FRAME KAI [2017年10月發送],/hk/item/N2382523001002,https://p-bandai.com/img/hk/p/t/N2382523001002_001.jpg
14,METAL BUILD TACTICAL ARMS II L & TIGER PIERCE OPTION SET [2017年10月發送],/hk/item/N2382524001002,https://p-bandai.com/img/hk/p/t/N2382524001002_001.jpg
14,METAL BUILD GUNDAM ASTRAY RED FRAME KAI,/hk/item/N2382523001001,https://p-bandai.com/img/hk/p/t/N2382523001001_001.jpg
14,METAL BUILD TACTICAL ARMS II L & TIGER PIERCE OPTION SET,/hk/item/N2382524001001,https://p-bandai.com/img/hk/p/t/N2382524001001_001.jpg
14,ROBOT SPIRITS 〈SIDE LABOR〉 TYRANT2000 & CONSTRACTION SCENE SET,/hk/item/N2382458001001,https://p-bandai.com/img/hk/p/t/N2382458001001_001.jpg
14,S.H.Figuarts SKYTURBO,/hk/item/N2291957001001,https://p-bandai.com/img/hk/p/t/N2291957001001_001.jpg
14,S.H.Figuarts SKYRIDER & SKYTURBO SET,/hk/item/N2334202001001,https://p-bandai.com/img/hk/p/t/N2334202001001_001.jpg
14,ROBOT SPIRITS 〈SIDE MS〉 GUNDAM Mk-V MARKING PLUS Ver.,/hk/item/N2375153001001,https://p-bandai.com/img/hk/p/t/N2375153001001_001.jpg
14,ULTRA-ACT x S.H.Figuarts BEMULAR,/hk/item/N2374818001001,https://p-bandai.com/img/hk/p/t/N2374818001001_001.jpg
14,S.I.C. KAMEN RIDER ZANGETSU SHIN MELON ENERGY ARMS,/hk/item/N2374822001001,https://p-bandai.com/img/hk/p/t/N2374822001001_001.jpg
14,ROBOT SPIRITS 〈SIDE MS〉 MS-06K ZAKU CANNON ver. A.N.I.M.E.,/hk/item/N2375155001001,https://p-bandai.com/img/hk/p/t/N2375155001001_001.jpg
14,GANSO SD GUNDAM WORLD KIKOUSHIN ELGAIYER,/hk/item/N2374804001001,https://p-bandai.com/img/hk/p/t/N2374804001001_001.jpg
14,Saint Cloth Myth BALRON RENE,/hk/item/N2374845001001,https://p-bandai.com/img/hk/p/t/N2374845001001_001.jpg
14,Saint Cloth Myth BALRON RENE Complete Set,/hk/item/N2374846001001,https://p-bandai.com/img/hk/p/t/N2374846001001_001.jpg
14,S.H.Figuarts KAMEN RIDER AMAZON SIGMA,/hk/item/N2375175001001,https://p-bandai.com/img/hk/p/t/N2375175001001_001.jpg
14,SOUL OF CHOGOKIN GX-70VS MAZINGER Z D.C. VS DEVILMAN OPTION SET,/hk/item/N2376941001001,https://p-bandai.com/img/hk/p/t/N2376941001001_001.jpg
14,Figuarts ZERO SAILOR NEPTUNE -Pretty Guardian Sailor Moon Crystal-,/hk/item/N2368815001001,https://p-bandai.com/img/hk/p/t/N2368815001001_001.jpg
14,S.H.Figuarts KAMEN RIDER HEART,/hk/item/N2375174001001,https://p-bandai.com/img/hk/p/t/N2375174001001_001.jpg
14,S.I.C. KAMEN RIDER BARON BANANA ARMS,/hk/item/N2330100001001,https://p-bandai.com/img/hk/p/t/N2330100001001_001.jpg
14,Figuarts ZERO SAILOR URANUS -Pretty Guardian Sailor Moon Crystal-,/hk/item/N2368814001001,https://p-bandai.com/img/hk/p/t/N2368814001001_001.jpg
15,S.I.C. MASHIN CHASER,/hk/item/N2368493001001,https://p-bandai.com/img/hk/p/t/N2368493001001_001.jpg
15,TAMASHII Lab Dragon Symphony ZYUSOUKEN,/hk/item/N2368893001001,https://p-bandai.com/img/hk/p/t/N2368893001001_001.jpg
15,S.H.Figuarts HEART ROIDMUDE OVER-EVOLVED FORM,/hk/item/N2370697001001,https://p-bandai.com/img/hk/p/t/N2370697001001_001.jpg
15,SAINT CLOTH MYTH EX  PEGASUS SEIYA 【NEW BRONZE CLOTH】～GOLDEN LIMITED EDITION～,/hk/item/A2352442001001,https://p-bandai.com/img/hk/p/t/A2352442001001_001.jpg
15,SAINT CLOTH MYTH EX  PHOENIX IKKI 【NEW BRONZE CLOTH】～GOLDEN LIMITED EDITION～,/hk/item/A2352443001001,https://p-bandai.com/img/hk/p/t/A2352443001001_001.jpg
15,METAL BUILD POWERED RED & 150 GERBERA STRAIGHT [POWER] OPTION SET,/hk/item/N2348574001001,https://p-bandai.com/img/hk/p/t/N2348574001001_001.jpg
15,PROPLICA x Figuarts Zero chouette Tuxedo Mirage memorial ornament,/hk/item/N2368894001001,https://p-bandai.com/img/hk/p/t/N2368894001001_001.jpg
15,ROBOT SPIRITS 〈SIDE LABOR〉 INGRAM 2nd,/hk/item/N2360982001001,https://p-bandai.com/img/hk/p/t/N2360982001001_001.jpg
15,S.H.Figuarts MASKED RIDER KUUGA AMAZING MIGHTY [2017年4月發送],/hk/item/N2325074001002,https://p-bandai.com/img/hk/p/t/N2325074001002_001.jpg
15,S.H.Figuarts KAMEN RIDER MACHCHASER,/hk/item/N2369061001001,https://p-bandai.com/img/hk/p/t/N2369061001001_001.jpg
15,ROBOT SPIRITS 〈SIDE LABOR〉 INGRAM 2nd  【TYPE98 SPECIAL CONTROL VEHICLE & PAINT GUN SET LIMITED EDITION】,/hk/item/N2368460001001,https://p-bandai.com/img/hk/p/t/N2368460001001_001.jpg
15,ROBOT SPIRITS 〈SIDE MS〉 RX-78-2 GUNDAM ver. A.N.I.M.E. -Theater Poster Real Type Color-,/hk/item/N2361925001001,https://p-bandai.com/img/hk/p/t/N2361925001001_001.jpg
15,SOUL OF CHOGOKIN GX-02R (TN2016 Anniv.) GREAT MAZINGER (Tamashii Nation 2016 Anniversary Ver.),/hk/item/N2361929001001,https://p-bandai.com/img/hk/p/t/N2361929001001_001.jpg
15,S.H.Figuarts MASKED RIDER DARK KABUTO,/hk/item/N2361926001001,https://p-bandai.com/img/hk/p/t/N2361926001001_001.jpg
15,SDX DIVINE KNIGHT WING,/hk/item/N2369518001001,https://p-bandai.com/img/hk/p/t/N2369518001001_001.jpg
15,Super Robot Chogokin GRENDIZER -KUROGANE FINISH-,/hk/item/N2368930001001,https://p-bandai.com/img/hk/p/t/N2368930001001_001.jpg
15,S.H.Figuarts HARDBOILDER,/hk/item/N2354566001001,https://p-bandai.com/img/hk/p/t/N2354566001001_001.jpg
15,ROBOT SPIRITS 〈SIDE MS〉 YMS-09 PROTOTYPE DOM ver. A.N.I.M.E.,/hk/item/N2369030001001,https://p-bandai.com/img/hk/p/t/N2369030001001_001.jpg
15,S.H.Figuarts SUPER SAILOR MERCURY,/hk/item/N2368811001001,https://p-bandai.com/img/hk/p/t/N2368811001001_001.jpg
15,S.H.MonsterArts SUPER MECHAGODZILLA,/hk/item/N2361764001001,https://p-bandai.com/img/hk/p/t/N2361764001001_001.jpg
15,ROBOT SPIRITS 〈SIDE MS〉 RX-75-4 GUNTANK & WHITE BASE DECK ver. A.N.I.M.E.,/hk/item/N2360983001001,https://p-bandai.com/img/hk/p/t/N2360983001001_001.jpg
15,PROPLICA Kaleido Moon Scope,/hk/item/N2361923001001,https://p-bandai.com/img/hk/p/t/N2361923001001_001.jpg
15,Figuarts ZERO SABO -ONE PIECE FILM GOLD Ver.-,/hk/item/N2367113001001,https://p-bandai.com/img/hk/p/t/N2367113001001_001.jpg
15,Figuarts ZERO KOALA -ONE PIECE FILM GOLD Ver.-,/hk/item/N2367114001001,https://p-bandai.com/img/hk/p/t/N2367114001001_001.jpg
15,S.H.MonsterArts DESTOROYAH (FINAL FORM) Special Color Ver.,/hk/item/N2368743001001,https://p-bandai.com/img/hk/p/t/N2368743001001_001.jpg
15,S.H.Figuarts Rock Lee,/hk/item/N2186457001001,https://p-bandai.com/img/hk/p/t/N2186457001001_001.jpg
15,S.H.Figuarts MASKED RIDER KUUGA AMAZING MIGHTY,/hk/item/N2325074001001,https://p-bandai.com/img/hk/p/t/N2325074001001_001.jpg
15,Figuarts ZERO SAILOR VENUS -Pretty Guardian Sailor Moon Crystal-,/hk/item/N2302509001001,https://p-bandai.com/img/hk/p/t/N2302509001001_001.jpg
15,ROBOT SPIRITS (Ka signature) 〈SIDE MS〉 DIJEH,/hk/item/N2361924001001,https://p-bandai.com/img/hk/p/t/N2361924001001_001.jpg
15,S.H.Figuarts Hijiri Minowa (school uniform),/hk/item/N2370370001001,https://p-bandai.com/img/hk/p/t/N2370370001001_001.jpg
15,S.H.Figuarts Masked Rider J,/hk/item/N2333605001001,https://p-bandai.com/img/hk/p/t/N2333605001001_001.jpg
15,ULTRA-ACT x S.H.Figuarts ACE SUIT,/hk/item/N2354072001001,https://p-bandai.com/img/hk/p/t/N2354072001001_001.jpg
16,S.H.Figuarts Hijiri Minowa (school uniform)& SUPER UCB50(BAKUON!!ver.),/hk/item/N2354238001001,https://p-bandai.com/img/hk/p/t/N2354238001001_001.jpg
16,Super Robot Chogokin Mazinger Z Kotetsu Jeeg color [2016年9月發送],/hk/item/N2340488001002,https://p-bandai.com/img/hk/p/t/N2340488001002_001.jpg
16,S.I.C. KAMEN RIDER RYUGEN BUDOU ARMS,/hk/item/N2330101001001,https://p-bandai.com/img/hk/p/t/N2330101001001_001.jpg
16,ROBOT SPIRITS 〈SIDE MS〉 MS-07C-5 GOUF TEST PROTOTYPE ver. A.N.I.M.E.,/hk/item/N2340495001001,https://p-bandai.com/img/hk/p/t/N2340495001001_001.jpg
16,GANSO SD GUNDAM WORLD SENNARI SHOGUN,/hk/item/N2354338001001,https://p-bandai.com/img/hk/p/t/N2354338001001_001.jpg
16,Figuarts ZERO Sailor Jupiter -Pretty Guardian Sailor Moon Crystal-,/hk/item/N2302508001001,https://p-bandai.com/img/hk/p/t/N2302508001001_001.jpg
16,Figuarts ZERO GUILD. TESORO,/hk/item/N2354350001001,https://p-bandai.com/img/hk/p/t/N2354350001001_001.jpg
16,Figuarts ZERO CARINA,/hk/item/N2354351001001,https://p-bandai.com/img/hk/p/t/N2354351001001_001.jpg
16,Figuarts ZERO MONKEY・D・LUFFY -ONE PIECE FILM GOLD Opening Ver.-,/hk/item/N2354352001001,https://p-bandai.com/img/hk/p/t/N2354352001001_001.jpg
16,S.H.MonsterArts GODZILLA(1995) Ultimate Burning Ver.,/hk/item/N2354071001001,https://p-bandai.com/img/hk/p/t/N2354071001001_001.jpg
16,Super Robot Chogokin Mazinger Z Kotetsu Jeeg color,/hk/item/N2340488001001,https://p-bandai.com/img/hk/p/t/N2340488001001_001.jpg
16,S.H.Figuarts N DAGUVA ZEBA,/hk/item/N2244574001001,https://p-bandai.com/img/hk/p/t/N2244574001001_001.jpg
16,S.I.C. KAMEN RIDER ZANGETSU MELON ARMS,/hk/item/N2330102001001,https://p-bandai.com/img/hk/p/t/N2330102001001_001.jpg
16,ROBOT SPIRITS 〈SIDE MS〉 MS-06D ZAKU DESERT TYPE ver. A.N.I.M.E.,/hk/item/N2340497001001,https://p-bandai.com/img/hk/p/t/N2340497001001_001.jpg
16,ROBOT SPIRITS 〈SIDE MS〉 DO-DAI YS＆GOUF OPTION SET ver. A.N.I.M.E.,/hk/item/N2340498001001,https://p-bandai.com/img/hk/p/t/N2340498001001_001.jpg
16,Figuarts Zero chouette CHIBI-USA & Helios,/hk/item/N2354233001001,https://p-bandai.com/img/hk/p/t/N2354233001001_001.jpg
16,ROBOT SPIRITS 〈SIDE MS〉 UNICORN GUNDAM (CRYSTAL BODY VER.),/hk/item/N2354235001001,https://p-bandai.com/img/hk/p/t/N2354235001001_001.jpg
16,S.H.Figuarts Masked Rider GATACK Rider Form [2016年10月發送],/hk/item/N2272173001002,https://p-bandai.com/img/hk/p/t/N2272173001002_001.jpg
16,Armor Girls Project MS GIRL GUNDAM Mk-II (A.E.U.G. COLOR),/hk/item/N2340894001001,https://p-bandai.com/img/hk/p/t/N2340894001001_001.jpg
16,Figuarts ZERO SENOR PINK,/hk/item/N2348208001001,https://p-bandai.com/img/hk/p/t/N2348208001001_001.jpg
16,S.H.Figuarts Onsa Amano(school uniform) ＆SEROW225W,/hk/item/N2348293001001,https://p-bandai.com/img/hk/p/t/N2348293001001_001.jpg
16,S.H.Figuarts UCHIHA SASUKE Itachi Battle,/hk/item/N2348299001001,https://p-bandai.com/img/hk/p/t/N2348299001001_001.jpg
16,S.H.Figuarts UCHIHA ITACHI,/hk/item/N2348350001001,https://p-bandai.com/img/hk/p/t/N2348350001001_001.jpg
16,SDX DAIFUKU SHOGUN,/hk/item/N2347709001001,https://p-bandai.com/img/hk/p/t/N2347709001001_001.jpg
16,S.H.Figuarts Inspector ZENIGATA,/hk/item/N2328232001001,https://p-bandai.com/img/hk/p/t/N2328232001001_001.jpg
16,S.H.Figuarts MASKED RIDER GATACK RIDER FORM,/hk/item/N2272173001001,https://p-bandai.com/img/hk/p/t/N2272173001001_001.jpg
16,Figuarts ZERO CAVENDISH,/hk/item/N2281105001001,https://p-bandai.com/img/hk/p/t/N2281105001001_001.jpg
16,S.H.Figuarts DAISUKE JIGEN,/hk/item/N2328233001001,https://p-bandai.com/img/hk/p/t/N2328233001001_001.jpg
16,Figuarts ZERO BARTOLOMEO  -Follower of Straw Hat Crew Ver.-,/hk/item/N2348207001001,https://p-bandai.com/img/hk/p/t/N2348207001001_001.jpg
16,S.H.Figuarts WINSPECTOR Full package option set,/hk/item/N2319785001001,https://p-bandai.com/img/hk/p/t/N2319785001001_001.jpg
16,S.H.Figuarts WHIS,/hk/item/N2334186001001,https://p-bandai.com/img/hk/p/t/N2334186001001_001.jpg
16,ROBOT SPIRITS 〈SIDE MS〉 FULL ARMOR GUNDAM Mk-II,/hk/item/N2340481001001,https://p-bandai.com/img/hk/p/t/N2340481001001_001.jpg
17,ROBOT SPIRITS 〈SIDE MS〉 MS-09RS RICK DOM CHAR’S CUSTOM MODEL ver. A.N.I.M.E.,/hk/item/N2340493001001,https://p-bandai.com/img/hk/p/t/N2340493001001_001.jpg
17,ROBOT SPIRITS 〈SIDE MS〉 RX-78-3 G-3 GUNDAM ver. A.N.I.M.E.,/hk/item/N2340494001001,https://p-bandai.com/img/hk/p/t/N2340494001001_001.jpg
17,Figuarts Zero chouette PRINCESS SERENITY,/hk/item/N2340899001001,https://p-bandai.com/img/hk/p/t/N2340899001001_001.jpg
17,METAL BUILD DESTINY GUNDAM ”WING OF LIGHT”OPTION SET [2016年11月發送],/hk/item/N2334162001002,https://p-bandai.com/img/hk/p/t/N2334162001002_001.jpg
17,GANSO SD GUNDAM WORLD GUNKILLER,/hk/item/N2340483001001,https://p-bandai.com/img/hk/p/t/N2340483001001_001.jpg
17,S.H.Figuarts MASKED RIDER KUUGA ULTIMATE FORM [2016年8月發送],/hk/item/N2161197001002,https://p-bandai.com/img/hk/p/t/N2161197001002_001.jpg
17,S.H.Figuarts BLACK LADY,/hk/item/N2327139001001,https://p-bandai.com/img/hk/p/t/N2327139001001_001.jpg
17,ULTRA-ACT x S.H.Figuarts ULTRAMAN SUIT ver 7.2,/hk/item/N2333060001001,https://p-bandai.com/img/hk/p/t/N2333060001001_001.jpg
17,METAL BUILD DESTINY GUNDAM (FULL PACKAGE) [2016年11月發送],/hk/item/N2334163001002,https://p-bandai.com/img/hk/p/t/N2334163001002_001.jpg
17,METAL BUILD DESTINY GUNDAM ”WING OF LIGHT”OPTION SET,/hk/item/N2334162001001,https://p-bandai.com/img/hk/p/t/N2334162001001_001.jpg
17,METAL BUILD DESTINY GUNDAM (FULL PACKAGE),/hk/item/N2334163001001,https://p-bandai.com/img/hk/p/t/N2334163001001_001.jpg
17,S.H.Figuarts MASKED RIDER KUUGA ULTIMATE FORM,/hk/item/N2161197001001,https://p-bandai.com/img/hk/p/t/N2161197001001_001.jpg
17,S.H.Figuarts UZUMAKI NARUTO SAGE MODE,/hk/item/N2334187001001,https://p-bandai.com/img/hk/p/t/N2334187001001_001.jpg
17,Figuarts ZERO CYBORG009 VS DEVILMAN,/hk/item/N2334843001001,https://p-bandai.com/img/hk/p/t/N2334843001001_001.jpg
17,SDX GOLD GOD SUPERIOR KAISER,/hk/item/N2340482001001,https://p-bandai.com/img/hk/p/t/N2340482001001_001.jpg
17,S.H.MonsterArts GODZILLA(2001),/hk/item/N2325947001001,https://p-bandai.com/img/hk/p/t/N2325947001001_001.jpg
17,Figuarts ZERO Taichi Yagami & Agumon -DIGIMON ADVENTURE tri.Ver.-,/hk/item/N2334382001001,https://p-bandai.com/img/hk/p/t/N2334382001001_001.jpg
17,S.H.Figuarts BIKEL,/hk/item/N2318764001001,https://p-bandai.com/img/hk/p/t/N2318764001001_001.jpg
17,ROBOT SPIRITS 〈SIDE MS〉 RICK DIAS,/hk/item/N2327655001001,https://p-bandai.com/img/hk/p/t/N2327655001001_001.jpg
17,ROBOT SPIRITS 〈SIDE MS〉 BARZAM CUSTOM,/hk/item/N2327670001001,https://p-bandai.com/img/hk/p/t/N2327670001001_001.jpg
17,Armor Girls Project MS GIRL GUNDAM Mk-II (TITANS COLOR) OPTION SET,/hk/item/N2327671001001,https://p-bandai.com/img/hk/p/t/N2327671001001_001.jpg
17,Figuarts ZERO Sailor Mars -Pretty Guardian Sailor Moon Crystal-,/hk/item/N2302507001001,https://p-bandai.com/img/hk/p/t/N2302507001001_001.jpg
17,METAL BUILD STRIKE FREEDOM GUNDAM ”WING OF LIGHT”OPTION SET,/hk/item/N2334161001001,https://p-bandai.com/img/hk/p/t/N2334161001001_001.jpg
17,ROBOT SPIRITS 〈SIDE RM〉 VILLKISS FINAL BATTLE Ver.,/hk/item/N2334502001001,https://p-bandai.com/img/hk/p/t/N2334502001001_001.jpg
17,METAL BUILD DESTINY GUNDAM Heine Westenfluss Custom [2016年6月發送],/hk/item/N2315189001003,https://p-bandai.com/img/hk/p/t/N2315189001003_001.jpg
17,METAL BUILD DESTINY GUNDAM Heine Westenfluss Custom [2016年5月發送],/hk/item/N2315189001002,https://p-bandai.com/img/hk/p/t/N2315189001002_001.jpg
17,TAMASHII EFFECT BURNING FLAME DARK Ver.,/hk/item/N2314598001001,https://p-bandai.com/img/hk/p/t/N2314598001001_001.jpg
17,METAL BUILD DESTINY GUNDAM Heine Westenfluss Custom,/hk/item/N2315189001001,https://p-bandai.com/img/hk/p/t/N2315189001001_001.jpg
17,Saint Cloth MYTH EX ARIES MU -ORIGINAL COLOR EDITION-,/hk/item/N2315297001001,https://p-bandai.com/img/hk/p/t/N2315297001001_001.jpg
17,PROPLICA Cosmic Heart Compact,/hk/item/N2327133001001,https://p-bandai.com/img/hk/p/t/N2327133001001_001.jpg
17,SOUL OF CHOGOKIN STAR GAOGAIGAR OPTION SET,/hk/item/N2327651001001,https://p-bandai.com/img/hk/p/t/N2327651001001_001.jpg
17,ULTRA-ACT x S.H.Figuarts ULTRAMAN Special Ver.,/hk/item/N2326505001001,https://p-bandai.com/img/hk/p/t/N2326505001001_001.jpg
18,S.H.Figuarts SUPER SAIYAN GOD SUPER SAIYAN VEGETA,/hk/item/N2327202001001,https://p-bandai.com/img/hk/p/t/N2327202001001_001.jpg
18,S.H.Figuarts Digimon(數碼暴龍) - WARGREYMON,/hk/item/N2327204001001,https://p-bandai.com/img/hk/p/t/N2327204001001_001.jpg
